{"brief":{"audience":"Developers","language":"zh-CN","objective":"Explain the handoff","presentation_type":"technical","topic":"Visual-first"},"deck_id":"deck_001","schema_version":"1.0","slides":[{"key_message":"Approved semantics survive visual design.","objects":[{"content_ref":"S01-title","id":"title-object","kind":"text","role":"title"},{"id":"card-01","kind":"shape","role":"step"},{"id":"card-02","kind":"shape","role":"step"},{"id":"connector-01","kind":"connector","relation_ref":"relation-01","role":"flow"}],"order":1,"role":"overview","section":"Architecture","semantic_structure":{"reading_order":["title-object","card-01","card-02"],"regions":[{"id":"region-main","members":["card-01","card-02"],"role":"main_content"}],"relations":[{"from_id":"card-01","id":"relation-01","kind":"sequence","to_id":"card-02"}]},"slide_id":"S01","source_refs":["brief-01"],"structured_data":[],"text_items":[{"id":"S01-title","role":"title","text":"Scoped revision"}],"visual_need":"Two connected cards and a chart.","wireframe":{"path":"wireframes/S01.md","sha256":"460fc4754d1eb9f043cced8202c17c2deb0d7c483caa0b511180ebdcba329b90"}}],"status":"approved"}
